{
  "aliases": [],
  "created_at": "2026-09-10T18:37:27Z",
  "extensions": {},
  "id": "urn:uuid:b6d2f7b8-f650-4d99-ab83-32dd3fa066f3",
  "managers": [
    {
      "kind": "apm",
      "lock_path": "apm.lock.yaml",
      "manifest_path": "apm.yml"
    }
  ],
  "name": "video-transcriber",
  "notes": "",
  "repository": {
    "subpath": null,
    "url": "https://github.com/leej3/video-transcriber"
  },
  "schema": "https://github.com/leej3/skills-workshop/schemas/memory/project-v0.schema.json",
  "updated_at": "2026-09-10T18:37:27Z"
}
