{
  "aliases": [],
  "created_at": "2026-08-18T20:35:33Z",
  "extensions": {},
  "id": "urn:uuid:4e3a79eb-dd6f-4e2c-b60c-4de70dcdb2e5",
  "managers": [
    {
      "kind": "apm",
      "lock_path": "apm.lock.yaml",
      "manifest_path": "apm.yml"
    }
  ],
  "name": "orinoco-lite-dev",
  "notes": "Engineering workspace with APM-pinned project skills.",
  "repository": {
    "subpath": null,
    "url": "https://github.com/con/orinoco-lite-dev.git"
  },
  "schema": "https://github.com/leej3/skills-workshop/schemas/memory/project-v0.schema.json",
  "updated_at": "2026-08-18T20:35:33Z"
}
