{
  "aliases": [],
  "created_at": "2026-08-17T19:47:17Z",
  "extensions": {},
  "id": "urn:uuid:7bea25b4-8855-4e71-a079-ae079a72c0c6",
  "managers": [
    {
      "kind": "apm",
      "lock_path": "apm.lock.yaml",
      "manifest_path": "apm.yml"
    }
  ],
  "name": "skills-workshop",
  "notes": "",
  "repository": {
    "subpath": null,
    "url": "https://github.com/leej3/skills-workshop.git"
  },
  "schema": "https://github.com/leej3/skills-workshop/schemas/memory/project-v0.schema.json",
  "updated_at": "2026-09-24T22:24:45Z"
}
